{
  "_D": "urn:oasis:names:specification:ubl:schema:xsd:ProofOfReexportationRequest-2",
  "_A": "urn:oasis:names:specification:ubl:schema:xsd:CommonAggregateComponents-2",
  "_B": "urn:oasis:names:specification:ubl:schema:xsd:CommonBasicComponents-2",
  "ProofOfReexportationRequest": [
    {
      "ID": [{ "_": "A2344" }],
      "IssueDate": [{ "_": "2019-06-21" }],
      "GoodsItemPassportID": [{ "_": "234222" }],
      "ImportingGuarantorParty": [
        {
          "PartyName": [
            {
              "Name": [
                { "_": "Deutscher Industrie- und Handelskammertag e.V." }
              ]
            }
          ],
          "PostalAddress": [
            {
              "StreetName": [{ "_": "Breite Straße" }],
              "BuildingNumber": [{ "_": "29" }],
              "CityName": [{ "_": "Berlin" }],
              "PostalZone": [{ "_": "10178" }],
              "Country": [
                {
                  "IdentificationCode": [{ "_": "DE" }]
                }
              ]
            }
          ],
          "PartyLegalEntity": [
            {
              "CompanyID": [{ "_": "DE122125278" }]
            }
          ]
        }
      ],
      "ExportingGuarantorParty": [
        {
          "PartyName": [
            {
              "Name": [{ "_": "Dansk Erhverv" }]
            }
          ],
          "PostalAddress": [
            {
              "StreetName": [{ "_": "Slotsholmsgade" }],
              "BuildingNumber": [{ "_": "1" }],
              "CityName": [{ "_": "København K" }],
              "PostalZone": [{ "_": "1216" }],
              "Country": [
                {
                  "IdentificationCode": [{ "_": "DK" }]
                }
              ]
            }
          ],
          "PartyLegalEntity": [
            {
              "CompanyID": [{ "_": "DK43232010" }]
            }
          ]
        }
      ],
      "ImportingCustomsParty": [
        {
          "PartyName": [
            {
              "Name": [{ "_": "Zollamt" }]
            }
          ],
          "PostalAddress": [
            {
              "StreetName": [{ "_": "Tollbrettkoppel" }],
              "BuildingNumber": [{ "_": "8" }],
              "CityName": [{ "_": "Heiligenhafen" }],
              "PostalZone": [{ "_": "23774" }],
              "Country": [
                {
                  "IdentificationCode": [{ "_": "DE" }]
                }
              ]
            }
          ]
        }
      ]
    }
  ]
}
